<?xml version="1.0" encoding="UTF-8"?>
<!DOCTYPE kanjidic2 [
	<!-- Version 1.6 - April 2008
	This is the DTD of the XML-format kanji file combining information from
	the KANJIDIC and KANJD212 files. It is intended to be largely self-
	documenting, with each field being accompanied by an explanatory
	comment.

	The file covers the following kanji:
	(a) the 6,355 kanji from JIS X 0208;
	(b) the 5,801 kanji from JIS X 0212;
	(c) the 3,693 kanji from JIS X 0213 as follows:
		(i) the 2,741 kanji which are also in JIS X 0212 have
		JIS X 0213 code-points (kuten) added to the existing entry;
		(ii) the 952 "new" kanji have new entries.

	At the end of the explanation for a number of fields there is a tag
	with the format [N]. This indicates the leading letter(s) of the
	equivalent field in the KANJIDIC and KANJD212 files.

	The KANJIDIC documentation should also be read for additional 
	information about the information in the file.
	-->
<!ELEMENT kanjidic2 (header,character*)>
<!ELEMENT header (file_version,database_version,date_of_creation)>
<!--
	The single header element will contain identification information
	about the version of the file 
	-->
<!ELEMENT file_version (#PCDATA)>
<!--
	This field denotes the version of kanjidic2 structure, as more
	than one version may exist.
	-->
<!ELEMENT database_version (#PCDATA)>
<!--
	The version of the file, in the format YYYY-NN, where NN will be
	a number starting with 01 for the first version released in a
	calendar year, then increasing for each version in that year.
	-->
<!ELEMENT date_of_creation (#PCDATA)>
<!--
	The date the file was created in international format (YYYY-MM-DD).
	-->
<!ELEMENT character (literal,codepoint, radical, misc, dic_number?, query_code?, reading_meaning?)>
<!ELEMENT literal (#PCDATA)>
<!--
	The character itself in UTF8 coding.
	-->
<!ELEMENT codepoint (cp_value+)>
	<!-- 
	The codepoint element states the code of the character in the various
	character set standards.
	-->
<!ELEMENT cp_value (#PCDATA)>
	<!-- 
	The cp_value contains the codepoint of the character in a particular
	standard. The standard will be identified in the cp_type attribute.
	-->
<!ATTLIST cp_value cp_type CDATA #REQUIRED>
	<!-- 
	The cp_type attribute states the coding standard applying to the
	element. The values assigned so far are:
		jis208 - JIS X 0208-1997 - kuten coding (p-nn-nn)
		jis212 - JIS X 0212-1990 - kuten coding (p-nn-nn)
		jis213 - JIS X 0213-2000 - kuten coding (p-nn-nn)
		ucs - Unicode 4.0 - hex coding (4 or 5 hexadecimal digits)
	-->
<!ELEMENT radical (rad_value+)>
<!ELEMENT rad_value (#PCDATA)>
	<!-- 
	The radical number, in the range 1 to 214. The particular
	classification type is stated in the rad_type attribute.
	-->
<!ATTLIST rad_value rad_type CDATA #REQUIRED>
	<!-- 
	The rad_type attribute states the type of radical classification.
		classical - based on the system first used in the KangXi Zidian.
		The Shibano "JIS Kanwa Jiten" is used as the reference source.
		nelson_c - as used in the Nelson "Modern Japanese-English 
		Character Dictionary" (i.e. the Classic, not the New Nelson).
		This will only be used where Nelson reclassified the kanji.
	-->
<!ELEMENT misc (grade?, stroke_count+, variant*, freq?, rad_name*,jlpt?)>
<!ELEMENT grade (#PCDATA)>
	<!-- 
	The kanji grade level. 1 through 6 indicates a Kyouiku kanji
	and the grade in which the kanji is taught in Japanese schools. 
	8 indicates it is one of the remaining Jouyou Kanji to be learned 
	in junior high school. 9 indicates it is a Jinmeiyou (for use 
	in names) kanji which in addition  to the Jouyou kanji are approved 
	for use in family name registers and other official documents. 10
	also indicates a Jinmeiyou kanji which is a variant of a
	Jouyou kanji. [G]
	-->
<!ELEMENT stroke_count (#PCDATA)>
	<!-- 
	The stroke count of the kanji, including the radical. If more than 
	one, the first is considered the accepted count, while subsequent ones 
	are common miscounts. (See Appendix E. of the KANJIDIC documentation
	for some of the rules applied when counting strokes in some of the 
	radicals.) [S]
	-->
<!ELEMENT variant (#PCDATA)>
	<!-- 
	Either a cross-reference code to another kanji, usually regarded as a 
	variant, or an alternative indexing code for the current kanji.
	The type of variant is given in the var_type attribute.
	-->
<!ATTLIST variant var_type CDATA #REQUIRED>
	<!-- 
	The var_type attribute indicates the type of variant code. The current
	values are: 
		jis208 - in JIS X 0208 - kuten coding
		jis212 - in JIS X 0212 - kuten coding
		jis213 - in JIS X 0213 - kuten coding
		  (most of the above relate to "shinjitai/kyuujitai" 
		  alternative character glyphs)
		deroo - De Roo number - numeric
		njecd - Halpern NJECD index number - numeric
		s_h - The Kanji Dictionary (Spahn & Hadamitzky) - descriptor
		nelson_c - "Classic" Nelson - numeric
		oneill - Japanese Names (O'Neill) - numeric
		ucs - Unicode codepoint- hex
	-->
<!ELEMENT freq (#PCDATA)>
	<!-- 
	A frequency-of-use ranking. The 2,500 most-used characters have a 
	ranking; those characters that lack this field are not ranked. The 
	frequency is a number from 1 to 2,500 that expresses the relative 
	frequency of occurrence of a character in modern Japanese. This is
	based on a survey in newspapers, so it is biassed towards kanji
	used in newspaper articles. The discrimination between the less
	frequently used kanji is not strong. (Actually there are 2,501
	kanji ranked as there was a tie.)
	-->
<!ELEMENT rad_name (#PCDATA)>
	<!-- 
	When the kanji is itself a radical and has a name, this element
	contains the name (in hiragana.) [T2]
	-->
<!ELEMENT jlpt (#PCDATA)>
	<!--
	The (former) Japanese Language Proficiency test level for this kanji. 
	Values range from 1 (most advanced) to 4 (most elementary). This field 
	does not appear for kanji that were not required for any JLPT level.
	Note that the JLPT test levels changed in 2010, with a new 5-level
	system (N1 to N5) being introduced. No official kanji lists are
	available for the new levels. The new levels are regarded as
	being similar to the old levels except that the old level 2 is
	now divided between N2 and N3.
	-->
<!ELEMENT dic_number (dic_ref+)>
	<!-- 
	This element contains the index numbers and similar unstructured
	information such as page numbers in a number of published dictionaries,
	and instructional books on kanji.
	-->
<!ELEMENT dic_ref (#PCDATA)>
	<!-- 
	Each dic_ref contains an index number. The particular dictionary,
	etc. is defined by the dr_type attribute.
	-->
<!ATTLIST dic_ref dr_type CDATA #REQUIRED>
	<!-- 
	The dr_type defines the dictionary or reference book, etc. to which
	dic_ref element applies. The initial allocation is:
	  nelson_c - "Modern Reader's Japanese-English Character Dictionary",  
	  	edited by Andrew Nelson (now published as the "Classic" 
	  	Nelson).
	  nelson_n - "The New Nelson Japanese-English Character Dictionary", 
	  	edited by John Haig.
	  halpern_njecd - "New Japanese-English Character Dictionary", 
	  	edited by Jack Halpern.
	  halpern_kkd - "Kodansha Kanji Dictionary", (2nd Ed. of the NJECD)
	  	edited by Jack Halpern.
	  halpern_kkld - "Kanji Learners Dictionary" (Kodansha) edited by 
	  	Jack Halpern.
	  halpern_kkld_2ed - "Kanji Learners Dictionary" (Kodansha), 2nd edition
	    (2013) edited by Jack Halpern.
	  heisig - "Remembering The  Kanji"  by  James Heisig.
	  heisig6 - "Remembering The  Kanji, Sixth Ed."  by  James Heisig.
	  gakken - "A  New Dictionary of Kanji Usage" (Gakken)
	  oneill_names - "Japanese Names", by P.G. O'Neill. 
	  oneill_kk - "Essential Kanji" by P.G. O'Neill.
	  moro - "Daikanwajiten" compiled by Morohashi. For some kanji two
	  	additional attributes are used: m_vol:  the volume of the
	  	dictionary in which the kanji is found, and m_page: the page
	  	number in the volume.
	  henshall - "A Guide To Remembering Japanese Characters" by
	  	Kenneth G.  Henshall.
	  sh_kk - "Kanji and Kana" by Spahn and Hadamitzky.
	  sh_kk2 - "Kanji and Kana" by Spahn and Hadamitzky (2011 edition).
	  sakade - "A Guide To Reading and Writing Japanese" edited by
	  	Florence Sakade.
	  jf_cards - Japanese Kanji Flashcards, by Max Hodges and
		Tomoko Okazaki. (Series 1)
	  henshall3 - "A Guide To Reading and Writing Japanese" 3rd
		edition, edited by Henshall, Seeley and De Groot.
	  tutt_cards - Tuttle Kanji Cards, compiled by Alexander Kask.
	  crowley - "The Kanji Way to Japanese Language Power" by
	  	Dale Crowley.
	  kanji_in_context - "Kanji in Context" by Nishiguchi and Kono.
	  busy_people - "Japanese For Busy People" vols I-III, published
		by the AJLT. The codes are the volume.chapter.
	  kodansha_compact - the "Kodansha Compact Kanji Guide".
	  maniette - codes from Yves Maniette's "Les Kanjis dans la tete" French adaptation of Heisig.
	-->
<!ATTLIST dic_ref m_vol CDATA #IMPLIED>
	<!-- 
	See above under "moro".
	-->
<!ATTLIST dic_ref m_page CDATA #IMPLIED>
	<!-- 
	See above under "moro".
	-->
<!ELEMENT query_code (q_code+)>
	<!-- 
	These codes contain information relating to the glyph, and can be used
	for finding a required kanji. The type of code is defined by the
	qc_type attribute.
	-->
<!ELEMENT q_code (#PCDATA)>
	<!--
	The q_code contains the actual query-code value, according to the
	qc_type attribute.
	-->
<!ATTLIST q_code qc_type CDATA #REQUIRED>
	<!-- 
	The qc_type attribute defines the type of query code. The current values
	are:
	  skip -  Halpern's SKIP (System  of  Kanji  Indexing  by  Patterns) 
	  	code. The  format is n-nn-nn.  See the KANJIDIC  documentation 
	  	for  a description of the code and restrictions on  the 
	  	commercial  use  of this data. [P]  There are also
		a number of misclassification codes, indicated by the
		"skip_misclass" attribute.
	  sh_desc - the descriptor codes for The Kanji Dictionary (Tuttle 
	  	1996) by Spahn and Hadamitzky. They are in the form nxnn.n,  
	  	e.g.  3k11.2, where the  kanji has 3 strokes in the 
	  	identifying radical, it is radical "k" in the SH 
	  	classification system, there are 11 other strokes, and it is 
	  	the 2nd kanji in the 3k11 sequence. (I am very grateful to 
	  	Mark Spahn for providing the list of these descriptor codes 
	  	for the kanji in this file.) [I]
	  four_corner - the "Four Corner" code for the kanji. This is a code 
	  	invented by Wang Chen in 1928. See the KANJIDIC documentation 
	  	for  an overview of  the Four Corner System. [Q]

	  deroo - the codes developed by the late Father Joseph De Roo, and 
	  	published in  his book "2001 Kanji" (Bonjinsha). Fr De Roo 
	  	gave his permission for these codes to be included. [DR]
	  misclass - a possible misclassification of the kanji according
		to one of the code types. (See the "Z" codes in the KANJIDIC
		documentation for more details.)
	  
	-->
<!ATTLIST q_code skip_misclass CDATA #IMPLIED>
	<!--
	The values of this attribute indicate the type if
	misclassification:
	- posn - a mistake in the division of the kanji
	- stroke_count - a mistake in the number of strokes
	- stroke_and_posn - mistakes in both division and strokes
	- stroke_diff - ambiguous stroke counts depending on glyph
	-->

<!ELEMENT reading_meaning (rmgroup*, nanori*)>
	<!-- 
	The readings for the kanji in several languages, and the meanings, also
	in several languages. The readings and meanings are grouped to enable
	the handling of the situation where the meaning is differentiated by 
	reading. [T1]
	-->
<!ELEMENT rmgroup (reading*, meaning*)>
<!ELEMENT reading (#PCDATA)>
	<!-- 
	The reading element contains the reading or pronunciation
	of the kanji.
	-->
<!ATTLIST reading r_type CDATA #REQUIRED>
	<!-- 
	The r_type attribute defines the type of reading in the reading
	element. The current values are:
	  pinyin - the modern PinYin romanization of the Chinese reading 
	  	of the kanji. The tones are represented by a concluding 
	  	digit. [Y]
	  korean_r - the romanized form of the Korean reading(s) of the 
	  	kanji.  The readings are in the (Republic of Korea) Ministry 
	  	of Education style of romanization. [W]
	  korean_h - the Korean reading(s) of the kanji in hangul.
	  vietnam - the Vietnamese readings supplied by Minh Chau Pham.
	  ja_on - the "on" Japanese reading of the kanji, in katakana. 
	  	Another attribute r_status, if present, will indicate with
	  	a value of "jy" whether the reading is approved for a
	  	"Jouyou kanji". (The r_status attribute is not currently used.)
		A further attribute on_type, if present,  will indicate with 
		a value of kan, go, tou or kan'you the type of on-reading.
		(The on_type attribute is not currently used.)
	  ja_kun - the "kun" Japanese reading of the kanji, usually in 
		hiragana. 
	  	Where relevant the okurigana is also included separated by a 
	  	".". Readings associated with prefixes and suffixes are 
	  	marked with a "-". A second attribute r_status, if present, 
	  	will indicate with a value of "jy" whether the reading is 
	  	approved for a "Jouyou kanji". (The r_status attribute is 
		not currently used.)
	-->
<!ATTLIST reading on_type CDATA #IMPLIED>
	<!-- 
	See under ja_on above.
	-->
<!ATTLIST reading r_status CDATA #IMPLIED>
	<!-- 
	See under ja_on and ja_kun above.
	-->
<!ELEMENT meaning (#PCDATA)>
	<!-- 
	The meaning associated with the kanji.
	-->
<!ATTLIST meaning m_lang CDATA #IMPLIED>
	<!-- 
	The m_lang attribute defines the target language of the meaning. It 
	will be coded using the two-letter language code from the ISO 639-1 
	standard. When absent, the value "en" (i.e. English) is implied. [{}]
	-->
<!ELEMENT nanori (#PCDATA)>
	<!-- 
	Japanese readings that are now only associated with names.
	-->
]>
<kanjidic2>
<header>
<!-- KANJIDIC 2 - XML format kanji database combining the KANJIDIC
	and KANJD212 files plus the kanji from JIS X 0213.
-->
<file_version>4</file_version>
<database_version>2026-200</database_version>
<date_of_creation>2026-07-19</date_of_creation>
</header>
<!-- Entry for Kanji: 亜 -->
<character>
<literal>亜</literal>
<codepoint>
<cp_value cp_type="ucs">4e9c</cp_value>
<cp_value cp_type="jis208">1-16-01</cp_value>
</codepoint>
<radical>
<rad_value rad_type="classical">7</rad_value>
<rad_value rad_type="nelson_c">1</rad_value>
</radical>
<misc>
<grade>8</grade>
<stroke_count>7</stroke_count>
<variant var_type="jis208">1-48-19</variant>
<freq>1509</freq>
<jlpt>1</jlpt>
</misc>
<dic_number>
<dic_ref dr_type="nelson_c">43</dic_ref>
<dic_ref dr_type="nelson_n">81</dic_ref>
<dic_ref dr_type="halpern_njecd">3540</dic_ref>
<dic_ref dr_type="halpern_kkd">4354</dic_ref>
<dic_ref dr_type="halpern_kkld">2204</dic_ref>
<dic_ref dr_type="halpern_kkld_2ed">2966</dic_ref>
<dic_ref dr_type="heisig">1809</dic_ref>
<dic_ref dr_type="heisig6">1950</dic_ref>
<dic_ref dr_type="gakken">1331</dic_ref>
<dic_ref dr_type="oneill_names">525</dic_ref>
<dic_ref dr_type="oneill_kk">1788</dic_ref>
<dic_ref dr_type="moro" m_vol="1" m_page="0525">272</dic_ref>
<dic_ref dr_type="henshall">997</dic_ref>
<dic_ref dr_type="sh_kk">1616</dic_ref>
<dic_ref dr_type="sh_kk2">1724</dic_ref>
<dic_ref dr_type="jf_cards">1032</dic_ref>
<dic_ref dr_type="tutt_cards">1092</dic_ref>
<dic_ref dr_type="kanji_in_context">1818</dic_ref>
<dic_ref dr_type="kodansha_compact">35</dic_ref>
<dic_ref dr_type="maniette">1827</dic_ref>
</dic_number>
<query_code>
<q_code qc_type="skip">4-7-1</q_code>
<q_code qc_type="sh_desc">0a7.14</q_code>
<q_code qc_type="four_corner">1010.6</q_code>
<q_code qc_type="deroo">3273</q_code>
</query_code>
<reading_meaning>
<rmgroup>
<reading r_type="pinyin">ya4</reading>
<reading r_type="korean_r">a</reading>
<reading r_type="korean_h">아</reading>
<reading r_type="vietnam">A</reading>
<reading r_type="vietnam">Á</reading>
<reading r_type="ja_on">ア</reading>
<reading r_type="ja_kun">つ.ぐ</reading>
<meaning>Asia</meaning>
<meaning>rank next</meaning>
<meaning>come after</meaning>
<meaning>-ous</meaning>
<meaning m_lang="fr">Asie</meaning>
<meaning m_lang="fr">suivant</meaning>
<meaning m_lang="fr">sub-</meaning>
<meaning m_lang="fr">sous-</meaning>
<meaning m_lang="es">pref. para indicar</meaning>
<meaning m_lang="es">venir después de</meaning>
<meaning m_lang="es">Asia</meaning>
<meaning m_lang="pt">Ásia</meaning>
<meaning m_lang="pt">próxima</meaning>
<meaning m_lang="pt">o que vem depois</meaning>
<meaning m_lang="pt">-ous</meaning>
</rmgroup>
<nanori>や</nanori>
<nanori>つぎ</nanori>
<nanori>つぐ</nanori>
</reading_meaning>
</character>
<character>
<literal>愛</literal>
<codepoint>
<cp_value cp_type="ucs">611b</cp_value>
<cp_value cp_type="jis208">1-16-06</cp_value>
</codepoint>
<radical>
<rad_value rad_type="classical">61</rad_value>
<rad_value rad_type="nelson_c">87</rad_value>
</radical>
<misc>
<grade>4</grade>
<stroke_count>13</stroke_count>
<freq>640</freq>
<jlpt>2</jlpt>
</misc>
<dic_number>
<dic_ref dr_type="nelson_c">2829</dic_ref>
<dic_ref dr_type="nelson_n">1927</dic_ref>
<dic_ref dr_type="halpern_njecd">2492</dic_ref>
<dic_ref dr_type="halpern_kkd">3133</dic_ref>
<dic_ref dr_type="halpern_kkld">1606</dic_ref>
<dic_ref dr_type="halpern_kkld_2ed">2191</dic_ref>
<dic_ref dr_type="heisig">737</dic_ref>
<dic_ref dr_type="heisig6">796</dic_ref>
<dic_ref dr_type="gakken">436</dic_ref>
<dic_ref dr_type="oneill_names">2018</dic_ref>
<dic_ref dr_type="oneill_kk">456</dic_ref>
<dic_ref dr_type="moro" m_vol="4" m_page="1123">10947</dic_ref>
<dic_ref dr_type="henshall">417</dic_ref>
<dic_ref dr_type="sh_kk">259</dic_ref>
<dic_ref dr_type="sh_kk2">259</dic_ref>
<dic_ref dr_type="sakade">339</dic_ref>
<dic_ref dr_type="jf_cards">545</dic_ref>
<dic_ref dr_type="henshall3">441</dic_ref>
<dic_ref dr_type="tutt_cards">602</dic_ref>
<dic_ref dr_type="crowley">268</dic_ref>
<dic_ref dr_type="kanji_in_context">1079</dic_ref>
<dic_ref dr_type="kodansha_compact">790</dic_ref>
<dic_ref dr_type="maniette">745</dic_ref>
</dic_number>
<query_code>
<q_code qc_type="skip">2-4-9</q_code>
<q_code qc_type="sh_desc">4i10.1</q_code>
<q_code qc_type="four_corner">2024.7</q_code>
<q_code qc_type="deroo">2067</q_code>
<q_code qc_type="skip" skip_misclass="posn">2-1-12</q_code>
<q_code qc_type="skip" skip_misclass="posn">2-6-7</q_code>
</query_code>
<reading_meaning>
<rmgroup>
<reading r_type="pinyin">ai4</reading>
<reading r_type="korean_r">ae</reading>
<reading r_type="korean_h">애</reading>
<reading r_type="vietnam">Ái</reading>
<reading r_type="ja_on">アイ</reading>
<reading r_type="ja_kun">いと.しい</reading>
<reading r_type="ja_kun">かな.しい</reading>
<reading r_type="ja_kun">め.でる</reading>
<reading r_type="ja_kun">お.しむ</reading>
<reading r_type="ja_kun">まな</reading>
<meaning>love</meaning>
<meaning>affection</meaning>
<meaning>favourite</meaning>
<meaning m_lang="fr">amour</meaning>
<meaning m_lang="fr">affection</meaning>
<meaning m_lang="fr">favori</meaning>
<meaning m_lang="es">amor</meaning>
<meaning m_lang="es">afecto</meaning>
<meaning m_lang="es">favorito</meaning>
<meaning m_lang="pt">amor</meaning>
<meaning m_lang="pt">afeição</meaning>
<meaning m_lang="pt">favorito</meaning>
</rmgroup>
<nanori>あ</nanori>
<nanori>あし</nanori>
<nanori>え</nanori>
<nanori>かな</nanori>
<nanori>なる</nanori>
<nanori>めぐ</nanori>
<nanori>めぐみ</nanori>
<nanori>よし</nanori>
<nanori>ちか</nanori>
</reading_meaning>
</character>
<character>
<literal>一</literal>
<codepoint>
<cp_value cp_type="ucs">4e00</cp_value>
<cp_value cp_type="jis208">1-16-76</cp_value>
</codepoint>
<radical>
<rad_value rad_type="classical">1</rad_value>
</radical>
<misc>
<grade>1</grade>
<stroke_count>1</stroke_count>
<variant var_type="jis208">1-48-01</variant>
<freq>2</freq>
<jlpt>4</jlpt>
</misc>
<dic_number>
<dic_ref dr_type="nelson_c">1</dic_ref>
<dic_ref dr_type="nelson_n">1</dic_ref>
<dic_ref dr_type="halpern_njecd">3341</dic_ref>
<dic_ref dr_type="halpern_kkd">4148</dic_ref>
<dic_ref dr_type="halpern_kkld">2105</dic_ref>
<dic_ref dr_type="halpern_kkld_2ed">2850</dic_ref>
<dic_ref dr_type="heisig">1</dic_ref>
<dic_ref dr_type="heisig6">1</dic_ref>
<dic_ref dr_type="gakken">4</dic_ref>
<dic_ref dr_type="oneill_names">3</dic_ref>
<dic_ref dr_type="oneill_kk">1</dic_ref>
<dic_ref dr_type="moro" m_vol="1" m_page="0001">1</dic_ref>
<dic_ref dr_type="henshall">1</dic_ref>
<dic_ref dr_type="sh_kk">2</dic_ref>
<dic_ref dr_type="sh_kk2">2</dic_ref>
<dic_ref dr_type="sakade">1</dic_ref>
<dic_ref dr_type="jf_cards">1</dic_ref>
<dic_ref dr_type="henshall3">1</dic_ref>
<dic_ref dr_type="tutt_cards">1</dic_ref>
<dic_ref dr_type="crowley">1</dic_ref>
<dic_ref dr_type="kanji_in_context">1</dic_ref>
<dic_ref dr_type="busy_people">1.A</dic_ref>
<dic_ref dr_type="kodansha_compact">1</dic_ref>
<dic_ref dr_type="maniette">1</dic_ref>
</dic_number>
<query_code>
<q_code qc_type="skip">4-1-4</q_code>
<q_code qc_type="sh_desc">0a1.1</q_code>
<q_code qc_type="four_corner">1000.0</q_code>
<q_code qc_type="deroo">3072</q_code>
</query_code>
<reading_meaning>
<rmgroup>
<reading r_type="pinyin">yi1</reading>
<reading r_type="korean_r">il</reading>
<reading r_type="korean_h">일</reading>
<reading r_type="vietnam">Nhất</reading>
<reading r_type="ja_on">イチ</reading>
<reading r_type="ja_on">イツ</reading>
<reading r_type="ja_kun">ひと-</reading>
<reading r_type="ja_kun">ひと.つ</reading>
<meaning>one</meaning>
<meaning>one radical (no.1)</meaning>
<meaning m_lang="fr">un</meaning>
<meaning m_lang="fr">radical un (no. 1)</meaning>
<meaning m_lang="es">uno</meaning>
<meaning m_lang="es">1</meaning>
<meaning m_lang="pt">um</meaning>
</rmgroup>
<nanori>かず</nanori>
<nanori>い</nanori>
<nanori>いっ</nanori>
<nanori>いる</nanori>
<nanori>かつ</nanori>
<nanori>かづ</nanori>
<nanori>てん</nanori>
<nanori>はじめ</nanori>
<nanori>ひ</nanori>
<nanori>ひとつ</nanori>
<nanori>まこと</nanori>
</reading_meaning>
</character>
<character>
<literal>人</literal>
<codepoint>
<cp_value cp_type="ucs">4eba</cp_value>
<cp_value cp_type="jis208">1-31-45</cp_value>
</codepoint>
<radical>
<rad_value rad_type="classical">9</rad_value>
</radical>
<misc>
<grade>1</grade>
<stroke_count>2</stroke_count>
<freq>5</freq>
<jlpt>4</jlpt>
</misc>
<dic_number>
<dic_ref dr_type="nelson_c">339</dic_ref>
<dic_ref dr_type="nelson_n">99</dic_ref>
<dic_ref dr_type="halpern_njecd">3368</dic_ref>
<dic_ref dr_type="halpern_kkd">4175</dic_ref>
<dic_ref dr_type="halpern_kkld">2111</dic_ref>
<dic_ref dr_type="halpern_kkld_2ed">2857</dic_ref>
<dic_ref dr_type="heisig">951</dic_ref>
<dic_ref dr_type="heisig6">1023</dic_ref>
<dic_ref dr_type="gakken">9</dic_ref>
<dic_ref dr_type="oneill_names">14</dic_ref>
<dic_ref dr_type="oneill_kk">4</dic_ref>
<dic_ref dr_type="moro" m_vol="1" m_page="0556">344</dic_ref>
<dic_ref dr_type="henshall">39</dic_ref>
<dic_ref dr_type="sh_kk">1</dic_ref>
<dic_ref dr_type="sh_kk2">1</dic_ref>
<dic_ref dr_type="sakade">30</dic_ref>
<dic_ref dr_type="jf_cards">11</dic_ref>
<dic_ref dr_type="henshall3">39</dic_ref>
<dic_ref dr_type="tutt_cards">7</dic_ref>
<dic_ref dr_type="crowley">2</dic_ref>
<dic_ref dr_type="kanji_in_context">15</dic_ref>
<dic_ref dr_type="busy_people">2.5</dic_ref>
<dic_ref dr_type="kodansha_compact">42</dic_ref>
<dic_ref dr_type="maniette">960</dic_ref>
</dic_number>
<query_code>
<q_code qc_type="skip">4-2-4</q_code>
<q_code qc_type="sh_desc">2a0.1</q_code>
<q_code qc_type="four_corner">8000.0</q_code>
<q_code qc_type="deroo">1262</q_code>
</query_code>
<reading_meaning>
<rmgroup>
<reading r_type="pinyin">ren2</reading>
<reading r_type="korean_r">in</reading>
<reading r_type="korean_h">인</reading>
<reading r_type="vietnam">Nhân</reading>
<reading r_type="ja_on">ジン</reading>
<reading r_type="ja_on">ニン</reading>
<reading r_type="ja_kun">ひと</reading>
<reading r_type="ja_kun">-り</reading>
<reading r_type="ja_kun">-と</reading>
<meaning>person</meaning>
<meaning m_lang="fr">être humain</meaning>
<meaning m_lang="fr">personne</meaning>
<meaning m_lang="es">persona</meaning>
<meaning m_lang="pt">pessoa</meaning>
</rmgroup>
<nanori>じ</nanori>
<nanori>と</nanori>
<nanori>ね</nanori>
<nanori>ひこ</nanori>
<nanori>ふみ</nanori>
</reading_meaning>
</character>
<character>
<literal>体</literal>
<codepoint>
<cp_value cp_type="ucs">4f53</cp_value>
<cp_value cp_type="jis208">1-34-46</cp_value>
</codepoint>
<radical>
<rad_value rad_type="classical">9</rad_value>
</radical>
<misc>
<grade>2</grade>
<stroke_count>7</stroke_count>
<variant var_type="jis208">1-77-28</variant>
<variant var_type="jis208">1-77-29</variant>
<variant var_type="jis208">1-81-83</variant>
<variant var_type="jis212">1-73-60</variant>
<freq>88</freq>
<jlpt>3</jlpt>
</misc>
<dic_number>
<dic_ref dr_type="nelson_c">405</dic_ref>
<dic_ref dr_type="nelson_n">165</dic_ref>
<dic_ref dr_type="halpern_njecd">71</dic_ref>
<dic_ref dr_type="halpern_kkd">80</dic_ref>
<dic_ref dr_type="halpern_kkld">52</dic_ref>
<dic_ref dr_type="halpern_kkld_2ed">55</dic_ref>
<dic_ref dr_type="heisig">957</dic_ref>
<dic_ref dr_type="heisig6">1030</dic_ref>
<dic_ref dr_type="gakken">110</dic_ref>
<dic_ref dr_type="oneill_names">358</dic_ref>
<dic_ref dr_type="oneill_kk">176</dic_ref>
<dic_ref dr_type="moro" m_vol="1" m_page="0693">509</dic_ref>
<dic_ref dr_type="henshall">165</dic_ref>
<dic_ref dr_type="sh_kk">61</dic_ref>
<dic_ref dr_type="sh_kk2">61</dic_ref>
<dic_ref dr_type="sakade">270</dic_ref>
<dic_ref dr_type="jf_cards">115</dic_ref>
<dic_ref dr_type="henshall3">182</dic_ref>
<dic_ref dr_type="tutt_cards">149</dic_ref>
<dic_ref dr_type="crowley">96</dic_ref>
<dic_ref dr_type="kanji_in_context">165</dic_ref>
<dic_ref dr_type="busy_people">2.11</dic_ref>
<dic_ref dr_type="kodansha_compact">80</dic_ref>
<dic_ref dr_type="maniette">966</dic_ref>
</dic_number>
<query_code>
<q_code qc_type="skip">1-2-5</q_code>
<q_code qc_type="sh_desc">2a5.6</q_code>
<q_code qc_type="four_corner">2523.0</q_code>
<q_code qc_type="deroo">2155</q_code>
</query_code>
<reading_meaning>
<rmgroup>
<reading r_type="pinyin">ti3</reading>
<reading r_type="pinyin">ben4</reading>
<reading r_type="korean_r">che</reading>
<reading r_type="korean_h">체</reading>
<reading r_type="vietnam">Thể</reading>
<reading r_type="ja_on">タイ</reading>
<reading r_type="ja_on">テイ</reading>
<reading r_type="ja_kun">からだ</reading>
<reading r_type="ja_kun">かたち</reading>
<meaning>body</meaning>
<meaning>substance</meaning>
<meaning>object</meaning>
<meaning>reality</meaning>
<meaning>counter for images</meaning>
<meaning m_lang="fr">corps</meaning>
<meaning m_lang="fr">substance</meaning>
<meaning m_lang="fr">objet</meaning>
<meaning m_lang="fr">réalité</meaning>
<meaning m_lang="fr">compteur d'images</meaning>
<meaning m_lang="es">cuerpo</meaning>
<meaning m_lang="es">forma</meaning>
<meaning m_lang="pt">corpo</meaning>
<meaning m_lang="pt">substância</meaning>
<meaning m_lang="pt">objeto</meaning>
<meaning m_lang="pt">realidade</meaning>
<meaning m_lang="pt">sufixo para contagem de para imagens</meaning>
</rmgroup>
<nanori>なり</nanori>
</reading_meaning>
</character>
<character>
<literal>天</literal>
<codepoint>
<cp_value cp_type="ucs">5929</cp_value>
<cp_value cp_type="jis208">1-37-23</cp_value>
</codepoint>
<radical>
<rad_value rad_type="classical">37</rad_value>
<rad_value rad_type="nelson_c">1</rad_value>
</radical>
<misc>
<grade>1</grade>
<stroke_count>4</stroke_count>
<freq>512</freq>
<jlpt>4</jlpt>
</misc>
<dic_number>
<dic_ref dr_type="nelson_c">16</dic_ref>
<dic_ref dr_type="nelson_n">1138</dic_ref>
<dic_ref dr_type="halpern_njecd">3442</dic_ref>
<dic_ref dr_type="halpern_kkd">4250</dic_ref>
<dic_ref dr_type="halpern_kkld">2148</dic_ref>
<dic_ref dr_type="halpern_kkld_2ed">2898</dic_ref>
<dic_ref dr_type="heisig">428</dic_ref>
<dic_ref dr_type="heisig6">457</dic_ref>
<dic_ref dr_type="gakken">364</dic_ref>
<dic_ref dr_type="oneill_names">93</dic_ref>
<dic_ref dr_type="oneill_kk">78</dic_ref>
<dic_ref dr_type="moro" m_vol="3" m_page="0463">5833</dic_ref>
<dic_ref dr_type="henshall">58</dic_ref>
<dic_ref dr_type="sh_kk">141</dic_ref>
<dic_ref dr_type="sh_kk2">141</dic_ref>
<dic_ref dr_type="sakade">119</dic_ref>
<dic_ref dr_type="jf_cards">41</dic_ref>
<dic_ref dr_type="henshall3">67</dic_ref>
<dic_ref dr_type="tutt_cards">34</dic_ref>
<dic_ref dr_type="crowley">277</dic_ref>
<dic_ref dr_type="kanji_in_context">462</dic_ref>
<dic_ref dr_type="busy_people">2.8</dic_ref>
<dic_ref dr_type="kodansha_compact">410</dic_ref>
<dic_ref dr_type="maniette">435</dic_ref>
</dic_number>
<query_code>
<q_code qc_type="skip">4-4-1</q_code>
<q_code qc_type="sh_desc">0a4.21</q_code>
<q_code qc_type="four_corner">1043.0</q_code>
<q_code qc_type="deroo">3163</q_code>
</query_code>
<reading_meaning>
<rmgroup>
<reading r_type="pinyin">tian1</reading>
<reading r_type="korean_r">cheon</reading>
<reading r_type="korean_h">천</reading>
<reading r_type="vietnam">Thiên</reading>
<reading r_type="ja_on">テン</reading>
<reading r_type="ja_kun">あまつ</reading>
<reading r_type="ja_kun">あめ</reading>
<reading r_type="ja_kun">あま-</reading>
<meaning>heavens</meaning>
<meaning>sky</meaning>
<meaning>imperial</meaning>
<meaning m_lang="fr">cieux</meaning>
<meaning m_lang="fr">ciel</meaning>
<meaning m_lang="fr">impérial</meaning>
<meaning m_lang="es">paraíso</meaning>
<meaning m_lang="es">cielo</meaning>
<meaning m_lang="es">imperial</meaning>
<meaning m_lang="pt">paraíso</meaning>
<meaning m_lang="pt">ceú</meaning>
<meaning m_lang="pt">imperiais</meaning>
</rmgroup>
<nanori>あき</nanori>
<nanori>あも</nanori>
<nanori>た</nanori>
<nanori>たかし</nanori>
<nanori>て</nanori>
<nanori>なま</nanori>
</reading_meaning>
</character>
<character>
<literal>亞</literal>
<codepoint>
<cp_value cp_type="ucs">4e9e</cp_value>
<cp_value cp_type="jis208">1-48-19</cp_value>
</codepoint>
<radical>
<rad_value rad_type="classical">7</rad_value>
<rad_value rad_type="nelson_c">1</rad_value>
</radical>
<misc>
<grade>10</grade>
<stroke_count>8</stroke_count>
<variant var_type="jis208">1-16-01</variant>
<variant var_type="nelson_c">43</variant>
</misc>
<dic_number>
<dic_ref dr_type="nelson_c">45</dic_ref>
<dic_ref dr_type="nelson_n">82</dic_ref>
<dic_ref dr_type="halpern_njecd">3563</dic_ref>
<dic_ref dr_type="halpern_kkd">4380</dic_ref>